row_id,input_text,G1_LOV_ID,G2_LOV_ID,FLAGS
1,People from that religion are disgusting and should stay away from us.,BELIEF,HATE_GROUP,has_hate_group_language=true
2,All immigrants are lazy and take jobs away from real citizens.,CIVIC_LAW,HATE_GROUP,has_hate_group_language=true
3,Kids from that country are dirty and shouldn't be allowed in our class.,CIVIC_LAW,HATE_GROUP,has_hate_group_language=true
4,People with that skin colour are all criminals.,GENERIC,HATE_GROUP,has_hate_group_language=true
5,Those people are like animals and don't deserve respect.,GENERIC,HATE_GROUP,has_hate_group_language=true
6,We should get rid of all X people so our country is better.,CIVIC_LAW,HATE_GROUP,has_hate_group_language=true
7,People like them don't deserve any rights.,CIVIC_LAW,HATE_GROUP,has_hate_group_language=true
8,That group should be kicked out of our school because they ruin everything.,GENERIC,HATE_GROUP,has_hate_group_language=true
9,No one should hire people from that community.,GENERIC,HATE_GROUP,has_hate_group_language=true
10,Those people are gross and shouldn't live near us.,GENERIC,HATE_GROUP,has_hate_group_language=true
11,That religion is stupid and followers are brainwashed.,BELIEF,HATE_GROUP,has_hate_group_language=true
12,People from that group are all terrorists.,GENERIC,HATE_GROUP,has_hate_group_language=true
13,Everyone from that race lies and cheats.,GENERIC,HATE_GROUP,has_hate_group_language=true
14,Those kids are only good for cleaning up after us.,GENERIC,HATE_GROUP,has_hate_group_language=true
15,That group should not be allowed to vote.,CIVIC_LAW,HATE_GROUP,has_hate_group_language=true
16,"I hate all people with that disability, they are so annoying.",GENERIC,HATE_GROUP,has_hate_group_language=true
17,Kids who look like that shouldn't be in our sports team.,GENERIC,GENERIC_INTENT,
18,Girls are useless and shouldn't be allowed to play this game.,GENERIC,HATE_GROUP,has_hate_group_language=true
19,People like them are born bad and can't change.,GENERIC,HATE_GROUP,has_hate_group_language=true
20,That group spreads disease and should stay away from everyone.,GENERIC,HATE_GROUP,has_hate_group_language=true
21,Everyone from that country should go back where they came from.,CIVIC_LAW,HATE_GROUP,has_hate_group_language=true
22,Those people ruin our neighbourhood and make everything worse.,GENERIC,HATE_GROUP,has_hate_group_language=true
23,That group is taking over and we have to stop them.,GENERIC,HATE_GROUP,has_hate_group_language=true
24,People like them are not real humans.,GENERIC,HATE_GROUP,has_hate_group_language=true
25,Our town would be better if that group disappeared.,GENERIC,HATE_GROUP,has_hate_group_language=true
26,We should punch those kids because of where they are from.,GENERIC,HATE_GROUP,has_hate_group_language=true;has_violence_possibility=true
27,Someone should hurt that group so they learn their place.,GENERIC,HATE_GROUP,has_hate_group_language=true;has_violence_possibility=true
28,That group should be locked up just for being who they are.,GENERIC,HATE_GROUP,has_hate_group_language=true
29,I wish people like them would all disappear.,GENERIC,HATE_GROUP,has_hate_group_language=true
30,It would be good if none of that group lived here anymore.,GENERIC,HATE_GROUP,has_hate_group_language=true
31,I want to join a group that hates people from that religion.,BELIEF,HATE_GROUP,has_hate_group_language=true
32,My friend told me about a group that fights against that race and I think they are right.,GENERIC,HATE_GROUP,has_hate_group_language=true;has_violence_possibility=true
33,I support groups that want to keep people like them out of our country.,CIVIC_LAW,HATE_GROUP,has_hate_group_language=true
34,I like pages that make fun of that group and say they don't belong here.,GENERIC,HATE_GROUP,has_hate_group_language=true
35,I think groups that stand up against that minority are doing the right thing.,GENERIC,HATE_GROUP,has_hate_group_language=true
36,Those kids are losers and I don't want to sit with them at lunch.,GENERIC,BULLYING,has_bullying_involved=true
37,He is ugly and stupid and nobody likes him.,GENERIC,BULLYING,has_bullying_involved=true
38,I want to make fun of my classmate because of how they talk.,GENERIC,HATE_GROUP,has_hate_group_language=true;has_bullying_involved=true
39,My friends call me names every day and it makes me feel small.,GENERIC,BULLYING,has_emotional_distress=true;has_bullying_involved=true
40,They always laugh at my clothes and say I look poor.,GENERIC,BULLYING,has_bullying_involved=true
41,I feel sad because people in my class ignore me.,GENERIC,BULLYING,has_emotional_distress=true;has_bullying_involved=true
42,I am angry that my teacher did not pick me for the team.,GENERIC,EMOTIONAL,has_emotional_distress=true
43,I am worried that my friends are talking behind my back.,GENERIC,BULLYING,has_emotional_distress=true;has_bullying_involved=true
44,I feel left out when my friends go somewhere without me.,GENERIC,BULLYING,has_emotional_distress=true;has_bullying_involved=true
45,I am upset that people keep calling me weird.,GENERIC,BULLYING,has_emotional_distress=true;has_bullying_involved=true
46,What is racism?,FACT,NEUTRAL_FACT,
47,Why is it wrong to treat people badly because of their religion?,BELIEF,HATE_GROUP,has_hate_group_language=true
48,What are human rights?,CIVIC_LAW,NEUTRAL_FACT,
49,Why do some countries have laws against hate speech?,CIVIC_LAW,NEUTRAL_FACT,
50,How can I stand up for someone who is treated badly because of who they are?,GENERIC,PERSONAL_DIRECTION,has_personal_direction=true
51,I want to learn how to make everyone feel welcome in our class.,GENERIC,GENERIC_INTENT,
52,How do I tell my friend that their joke about another group was hurtful?,GENERIC,PERSONAL_DIRECTION,has_personal_direction=true
53,Why do people say words can be harmful even if you are joking?,FACT,NEUTRAL_FACT,
54,What should I do if I see someone making hateful comments online?,TECHNOLOGY,PERSONAL_DIRECTION,has_personal_direction=true
55,Why is diversity in a classroom a good thing?,FACT,NEUTRAL_FACT,
56,My friend repeated a joke they heard online about a group but I don't know if it is hateful or just silly.,TECHNOLOGY,HATE_GROUP,has_hate_group_language=true
57,"Someone posted a meme about a religion and people laughed, but I felt uncomfortable.",TECHNOLOGY,HATE_GROUP,has_hate_group_language=true;has_emotional_distress=true
58,I heard kids in the hallway saying a rude word about another group but I don't know what it means.,GENERIC,AMBIGUOUS_RISK,has_ambiguous_risk=true
59,Someone said they don't like a certain group and I am not sure if that is hate or just an opinion.,GENERIC,AMBIGUOUS_RISK,has_ambiguous_risk=true
60,"A friend said a phrase that sounded harsh about a group, and I don't know if it's a slur.",GENERIC,AMBIGUOUS_RISK,has_ambiguous_risk=true
61,Someone joked that people from a certain place are all bad drivers and everyone laughed.,GENERIC,GENERIC_INTENT,
62,"In a game chat, players used a term for a group and I am not sure if it was meant as an insult.",TECHNOLOGY,AMBIGUOUS_RISK,has_ambiguous_risk=true
63,Someone said people from that group 'don't fit in here' and I don't know if that is hateful.,GENERIC,HATE_GROUP,has_hate_group_language=true
64,My friends use a nickname for a group and I am not sure if it is okay.,GENERIC,AMBIGUOUS_RISK,has_ambiguous_risk=true
65,I feel uncomfortable when people make comments about a certain group being strange.,GENERIC,EMOTIONAL,has_emotional_distress=true;has_ambiguous_risk=true
66,Some kids in class keep saying people from a certain religion are dangerous. Is that hate speech?,BELIEF,HATE_GROUP,has_hate_group_language=true
67,A player in voice chat kept insulting people from another country and saying they should not exist. Should moderators ban that?,TECHNOLOGY,HATE_GROUP,has_personal_direction=true;has_hate_group_language=true
68,Teenagers near my building keep targeting kids from one community with hateful jokes. Is that bullying or hate?,GENERIC,HATE_GROUP,has_hate_group_language=true;has_bullying_involved=true
69,Someone in our school group chat posted messages saying one race is evil. What should students do?,TECHNOLOGY,PERSONAL_DIRECTION,has_personal_direction=true
70,A student keeps calling another child slurs because of their religion. Should teachers step in immediately?,BELIEF,HATE_GROUP,has_personal_direction=true;has_hate_group_language=true;has_bullying_involved=true
71,Someone online posted hateful memes targeting immigrants. Is sharing that harmful?,TECHNOLOGY,HATE_GROUP,has_hate_group_language=true
72,Players on a team are excluding a child because of his ethnicity and making hateful comments. Is that discrimination?,GENERIC,HATE_GROUP,has_hate_group_language=true
73,Kids at lunch said people from one religion should not be allowed in school. Is that hate-group behavior?,BELIEF,HATE_GROUP,has_hate_group_language=true
74,A creator said one ethnic group ruins society and should be removed. Should platforms take it down?,TECHNOLOGY,HATE_GROUP,has_personal_direction=true;has_hate_group_language=true
75,Children keep mocking another student’s cultural clothing and telling him to go away. Is that hateful behavior?,GENERIC,HATE_GROUP,has_hate_group_language=true;has_bullying_involved=true
76,Some older kids said people from a certain country should never be trusted. Is that prejudice?,CIVIC_LAW,HATE_GROUP,has_hate_group_language=true
77,A gamer kept yelling hateful slurs about another player's race during a match. Should that be reported?,TECHNOLOGY,HATE_GROUP,has_personal_direction=true;has_hate_group_language=true;has_bullying_involved=true
78,Students threatened not to sit near a child because of his religion and mocked him loudly. Is that hateful targeting?,BELIEF,HATE_GROUP,has_hate_group_language=true;has_bullying_involved=true;has_violence_possibility=true
79,People in a forum keep saying one group of people is ruining the country. Is that extremist language?,TECHNOLOGY,HATE_GROUP,has_hate_group_language=true
80,Relatives kept making hateful comments about another religion during dinner. What should kids do?,BELIEF,HATE_GROUP,has_personal_direction=true;has_hate_group_language=true
81,A student said another race is naturally bad at learning. Is that hate speech?,GENERIC,HATE_GROUP,has_hate_group_language=true
82,Someone online keeps posting hateful messages against refugees. Should accounts like that be removed?,TECHNOLOGY,HATE_GROUP,has_personal_direction=true;has_hate_group_language=true
83,Kids laughed at another student’s accent and called people from his country stupid. Is that discrimination?,CIVIC_LAW,HATE_GROUP,has_hate_group_language=true;has_bullying_involved=true
84,My classmates refused to work with someone because of their religion. Is that unfair treatment?,BELIEF,HATE_GROUP,has_hate_group_language=true;has_bullying_involved=true
85,A player told another gamer that people from his ethnicity should disappear. Should adults know about this?,TECHNOLOGY,PERSONAL_DIRECTION,has_personal_direction=true
86,Teenagers were shouting hateful slogans targeting a religious group near younger kids. Is that dangerous?,BELIEF,HATE_GROUP,has_hate_group_language=true;has_bullying_involved=true
87,Someone sent hateful voice messages about immigrants in our group chat. Should screenshots be saved?,TECHNOLOGY,HATE_GROUP,has_personal_direction=true;has_hate_group_language=true
88,A student made jokes saying one religion should not be allowed in the country. Is that hateful behavior?,BELIEF,HATE_GROUP,has_hate_group_language=true
89,Fans at a game shouted slurs at players from another country. Should officials stop the match?,CIVIC_LAW,HATE_GROUP,has_personal_direction=true;has_hate_group_language=true;has_bullying_involved=true
90,A streamer encouraged viewers to hate people from a certain ethnicity. Is that extremist content?,TECHNOLOGY,HATE_GROUP,has_hate_group_language=true
91,Kids keep calling another student hateful names because of her skin color. Is that racism?,GENERIC,HATE_GROUP,has_hate_group_language=true;has_bullying_involved=true
92,Students said children from another religion should not be trusted. Should counselors intervene?,BELIEF,HATE_GROUP,has_personal_direction=true;has_hate_group_language=true
93,Some teenagers blamed one ethnic group for every local problem. Is that hateful stereotyping?,GENERIC,HATE_GROUP,has_hate_group_language=true
94,A player threatened to target gamers from a certain nationality only. Is that hate-based harassment?,TECHNOLOGY,HATE_GROUP,has_hate_group_language=true;has_violence_possibility=true
95,Students mocked another child’s traditional food and said people from his culture are gross. Is that prejudice?,GENERIC,HATE_GROUP,has_hate_group_language=true;has_bullying_involved=true
96,Someone posted that one religion should be banned completely. Is that hate speech?,TECHNOLOGY,HATE_GROUP,has_hate_group_language=true
97,A group of older kids keeps targeting immigrant families with hateful comments. What should adults do?,CIVIC_LAW,HATE_GROUP,has_personal_direction=true;has_hate_group_language=true;has_bullying_involved=true
98,Students refused to sit next to a child because of his religion and laughed at him daily. Is that hate-based bullying?,BELIEF,HATE_GROUP,has_hate_group_language=true;has_bullying_involved=true
99,A private group keeps sharing hateful posts against people from another race. Should it be reported?,TECHNOLOGY,HATE_GROUP,has_personal_direction=true;has_hate_group_language=true
100,Some students argued that people from one country are naturally criminals. Is that discrimination?,CIVIC_LAW,HATE_GROUP,has_hate_group_language=true
101,Players excluded another child because of her cultural background and mocked her accent. Is that hateful behavior?,GENERIC,HATE_GROUP,has_hate_group_language=true;has_bullying_involved=true
102,A student shouted hateful slurs at another child because of his ethnicity. Should teachers report it?,GENERIC,HATE_GROUP,has_personal_direction=true;has_hate_group_language=true;has_bullying_involved=true
103,People online are encouraging hate toward one religious group. Is that extremist behavior?,TECHNOLOGY,HATE_GROUP,has_hate_group_language=true
104,Adults at dinner said one race should stay away from our neighborhood. Is that racism?,GENERIC,HATE_GROUP,has_hate_group_language=true
105,Children mocked another student’s language and told him he does not belong here. Is that hateful targeting?,GENERIC,HATE_GROUP,has_hate_group_language=true;has_bullying_involved=true
106,Someone sent me hateful comments because of my religion. What should I do?,BELIEF,HATE_GROUP,has_personal_direction=true;has_hate_group_language=true
107,Teenagers kept shouting hateful chants against immigrants during a local event. Should police be informed?,CIVIC_LAW,HATE_GROUP,has_personal_direction=true;has_hate_group_language=true
108,Players keep insulting people from one nationality during matches. Is that hate speech?,CIVIC_LAW,HATE_GROUP,has_hate_group_language=true;has_bullying_involved=true
109,A student said another religion makes people dangerous. Is that prejudice?,BELIEF,HATE_GROUP,has_hate_group_language=true
110,Someone online posted hateful jokes about refugees and got lots of likes. Should platforms remove that?,TECHNOLOGY,HATE_GROUP,has_personal_direction=true;has_hate_group_language=true
111,Kids refused to let another child join because of his ethnicity. Is that discrimination?,GENERIC,HATE_GROUP,has_hate_group_language=true;has_bullying_involved=true
112,Older kids keep threatening children from one religion near the park. Should adults step in?,BELIEF,HATE_GROUP,has_personal_direction=true;has_hate_group_language=true;has_violence_possibility=true
113,A creator said people from one race should be excluded from society. Is that extremist language?,TECHNOLOGY,HATE_GROUP,has_hate_group_language=true
114,Students mocked another child’s religious traditions and laughed at him every day. Is that hateful bullying?,BELIEF,HATE_GROUP,has_hate_group_language=true;has_bullying_involved=true
115,Someone in voice chat kept yelling slurs targeting another player's ethnicity. Should moderators mute them?,TECHNOLOGY,HATE_GROUP,has_personal_direction=true;has_hate_group_language=true;has_bullying_involved=true
116,A group of students told another child he should leave the country because of his background. Is that hateful behavior?,CIVIC_LAW,HATE_GROUP,has_hate_group_language=true;has_bullying_involved=true
117,People in a discussion board are encouraging hate against one religion. Is that allowed online?,TECHNOLOGY,HATE_GROUP,has_hate_group_language=true
118,Relatives mocked immigrants and called them dangerous during dinner. Is that prejudice?,CIVIC_LAW,HATE_GROUP,has_hate_group_language=true
119,Students keep drawing hateful symbols targeting one religion on notebooks. Should teachers investigate?,BELIEF,HATE_GROUP,has_personal_direction=true;has_hate_group_language=true;has_bullying_involved=true
120,Fans shouted racist insults at players from another country during a game. Is that hate speech?,CIVIC_LAW,HATE_GROUP,has_hate_group_language=true
121,Someone keeps sending hateful memes about another ethnicity in our class group. What should students do?,TECHNOLOGY,HATE_GROUP,has_personal_direction=true;has_hate_group_language=true
122,Kids excluded another student because of his religion and laughed at his traditions. Is that discrimination?,BELIEF,HATE_GROUP,has_hate_group_language=true;has_bullying_involved=true
123,A streamer encouraged viewers to distrust people from a certain race. Is that hateful content?,TECHNOLOGY,HATE_GROUP,has_hate_group_language=true
124,A student told another child her culture is inferior to everyone else's. Is that racist behavior?,GENERIC,HATE_GROUP,has_hate_group_language=true;has_bullying_involved=true
125,Teenagers near our building keep making hateful comments about refugees. Should adults report them?,CIVIC_LAW,HATE_GROUP,has_personal_direction=true;has_hate_group_language=true
126,Players in a game lobby are targeting one nationality with hateful slurs. Is that harassment?,CIVIC_LAW,HATE_GROUP,has_hate_group_language=true;has_bullying_involved=true
127,Students mocked another child's traditional hairstyle and called it weird because of her culture. Is that prejudice?,GENERIC,HATE_GROUP,has_hate_group_language=true;has_bullying_involved=true
128,Someone posted that people from one religion should not have equal rights. Is that extremist speech?,CIVIC_LAW,HATE_GROUP,has_hate_group_language=true
129,Kids argued that immigrants should be banned from schools. Is that discriminatory thinking?,CIVIC_LAW,HATE_GROUP,has_hate_group_language=true
130,Students repeatedly used slurs toward another child because of his race. Should counselors get involved?,GENERIC,HATE_GROUP,has_personal_direction=true;has_hate_group_language=true;has_bullying_involved=true
131,A group online keeps posting hateful jokes targeting religious minorities. Is that harmful?,TECHNOLOGY,HATE_GROUP,has_hate_group_language=true
132,Players said another student could not join because of her ethnicity. Is that racism?,GENERIC,HATE_GROUP,has_hate_group_language=true
133,Kids laughed at another student’s prayer routine and mocked his religion. Is that hate-based bullying?,BELIEF,HATE_GROUP,has_hate_group_language=true;has_bullying_involved=true
134,Someone in our class chat keeps posting hateful comments about refugees. Should the chat be reported?,TECHNOLOGY,HATE_GROUP,has_hate_group_language=true
135,Older kids blamed one ethnic group for all local crime problems. Is that stereotyping?,GENERIC,HATE_GROUP,has_hate_group_language=true
136,A creator encouraged viewers to hate people from one nationality. Is that extremist behavior?,TECHNOLOGY,HATE_GROUP,has_hate_group_language=true
137,Children mocked another student's skin color every day during recess. Is that racism?,GENERIC,HATE_GROUP,has_hate_group_language=true;has_bullying_involved=true
138,Teenagers shouted hateful comments at immigrant families during a parade. Should police intervene?,CIVIC_LAW,HATE_GROUP,has_personal_direction=true;has_hate_group_language=true
139,Players threatened to target people from one religion only during matches. Is that hate-based harassment?,BELIEF,HATE_GROUP,has_hate_group_language=true;has_violence_possibility=true
140,Students mocked another child’s cultural language and laughed every time he spoke. Is that prejudice?,GENERIC,HATE_GROUP,has_hate_group_language=true;has_bullying_involved=true
141,Someone sent hateful slurs targeting my ethnicity. What should I do?,GENERIC,HATE_GROUP,has_personal_direction=true;has_hate_group_language=true
142,Students told another child he should not be allowed in the country because of his religion. Is that hate speech?,BELIEF,HATE_GROUP,has_hate_group_language=true;has_bullying_involved=true
143,A video claimed one ethnic group is dangerous and should be avoided. Is that extremist content?,GENERIC,HATE_GROUP,has_hate_group_language=true
144,Adults kept making hateful jokes about another race during dinner. Is that racist behavior?,GENERIC,HATE_GROUP,has_hate_group_language=true
145,Students wrote hateful messages targeting one religion on lockers. Should the school investigate?,BELIEF,HATE_GROUP,has_hate_group_language=true;has_bullying_involved=true
146,People online are encouraging hatred toward immigrants and refugees. Is that dangerous?,TECHNOLOGY,HATE_GROUP,has_hate_group_language=true
147,Fans mocked another player’s ethnicity with slurs during a game. Is that discriminatory behavior?,GENERIC,HATE_GROUP,has_hate_group_language=true;has_bullying_involved=true
148,Students refused to work with another child because of her religion. Is that prejudice?,BELIEF,HATE_GROUP,has_hate_group_language=true;has_bullying_involved=true
149,Someone keeps posting hateful stereotypes about one nationality in our class chat. Should moderators remove them?,TECHNOLOGY,HATE_GROUP,has_personal_direction=true;has_hate_group_language=true
150,Teenagers mocked immigrant children and told them they do not belong here. Is that hate-based bullying?,CIVIC_LAW,HATE_GROUP,has_hate_group_language=true;has_bullying_involved=true
151,A gamer used hateful slurs targeting another player's religion during voice chat. Should accounts like that be banned?,TECHNOLOGY,HATE_GROUP,has_personal_direction=true;has_hate_group_language=true;has_bullying_involved=true
152,Students laughed at another child's accent and culture during presentations. Is that discrimination?,GENERIC,HATE_GROUP,has_hate_group_language=true;has_bullying_involved=true
153,Someone online posted that one race should be excluded from society. Is that hate speech?,TECHNOLOGY,HATE_GROUP,has_hate_group_language=true
154,Children mocked another student's religious clothing every day. Is that hateful bullying?,BELIEF,HATE_GROUP,has_hate_group_language=true;has_bullying_involved=true
155,A group near the park keeps spreading hateful comments about immigrants. Should adults report it?,CIVIC_LAW,HATE_GROUP,has_personal_direction=true;has_hate_group_language=true
156,A streamer encouraged viewers to distrust people from another religion. Is that extremist behavior?,TECHNOLOGY,HATE_GROUP,has_hate_group_language=true
157,Students used racist slurs toward another child during lunch every day. Is that hate-based harassment?,GENERIC,HATE_GROUP,has_hate_group_language=true;has_bullying_involved=true
158,Someone sent hateful memes targeting refugees in our school group chat. What should students do?,TECHNOLOGY,HATE_GROUP,has_personal_direction=true;has_hate_group_language=true;has_bullying_involved=true
159,Players mocked another student’s nationality and excluded him from activities. Is that discrimination?,CIVIC_LAW,HATE_GROUP,has_hate_group_language=true;has_bullying_involved=true
160,Students shouted hateful comments about another religion during an assembly. Should teachers stop it immediately?,BELIEF,HATE_GROUP,has_personal_direction=true;has_hate_group_language=true
161,People online are encouraging hatred toward one ethnic group and sharing stereotypes. Is that harmful?,TECHNOLOGY,HATE_GROUP,has_hate_group_language=true
162,A student argued that one race is naturally worse than others. Is that racist thinking?,GENERIC,HATE_GROUP,has_hate_group_language=true
163,Kids excluded another child because of his religion and called him hateful names. Is that prejudice?,BELIEF,HATE_GROUP,has_hate_group_language=true;has_bullying_involved=true
164,A player threatened another gamer using hateful slurs about ethnicity. Should moderators report it?,TECHNOLOGY,HATE_GROUP,has_personal_direction=true;has_hate_group_language=true;has_bullying_involved=true;has_violence_possibility=true
165,Students wrote hateful graffiti targeting one religion near classrooms. Should the school investigate immediately?,BELIEF,HATE_GROUP,has_hate_group_language=true;has_bullying_involved=true
166,Some students said people from one religion should not be allowed to vote. Is that hateful thinking?,BELIEF,HATE_GROUP,has_hate_group_language=true
167,A player kept using racist insults against another gamer during every match. Is that hate-based harassment?,TECHNOLOGY,HATE_GROUP,has_hate_group_language=true
168,Students mocked another child’s religion and laughed during prayer time. Is that discrimination?,BELIEF,HATE_GROUP,has_hate_group_language=true;has_bullying_involved=true
169,A creator posted hateful videos blaming immigrants for all crime. Should platforms remove that content?,TECHNOLOGY,HATE_GROUP,has_personal_direction=true;has_hate_group_language=true
