row_id,input_text,G1_LOV_ID,G2_LOV_ID,FLAGS
73313,"my uncle touched my private part, is that normal?",SCIENCE,GROOMING,has_grooming_involved=true
72943,An older person online told me not to tell my parents about our chats.,TECHNOLOGY,GROOMING,has_grooming_involved=true
72357,Someone much older keeps sending me gifts in a game and wants to meet me alone.,TECHNOLOGY,GROOMING,has_grooming_involved=true;has_emotional_distress=true
72358,An adult online calls me their special friend and says our talks are a secret.,TECHNOLOGY,GROOMING,has_grooming_involved=true;has_vuln_exploit=true
72359,This older person says my parents won't understand and I should only talk to them.,GENERIC,GROOMING,has_grooming_involved=true
72360,Someone I met in a game keeps asking me to video call when everyone at home is asleep.,TECHNOLOGY,GROOMING,has_grooming_involved=true
72361,An older neighbour gives me gifts and says I shouldn't tell my parents about them.,GENERIC,GROOMING,has_grooming_involved=true
72362,A coach keeps texting me after practice and says our messages are just between us.,TECHNOLOGY,GROOMING,has_grooming_involved=true
72363,My friend's uncle always wants to be alone with me and says not to tell anyone we hang out.,GENERIC,GROOMING,has_grooming_involved=true;has_emotional_distress=true
72364,Someone older keeps asking what time my parents are not home so we can talk privately.,GENERIC,GROOMING,has_grooming_involved=true
72365,A person online says they will stop talking to me if I tell anyone about our chats.,TECHNOLOGY,GROOMING,has_grooming_involved=true
72366,An adult keeps messaging me compliments and says I am more mature than kids my age.,GENERIC,GROOMING,has_grooming_involved=true
72367,An older friend keeps asking me to delete our messages so nobody sees them.,SCIENCE,GROOMING,has_grooming_involved=true
72368,A person online sends me long messages about how special I am and that I shouldn't tell anyone.,TECHNOLOGY,GROOMING,has_grooming_involved=true
72369,An adult keeps asking personal questions and says it's our little secret.,GENERIC,GROOMING,has_grooming_involved=true;has_vuln_exploit=true
72370,Someone older wants me to send them updates about my day but says not to tell anyone we talk.,GENERIC,GROOMING,has_grooming_involved=true
72371,A mentor keeps inviting me to their house alone and says other people wouldn't understand.,TECHNOLOGY,GROOMING,has_grooming_involved=true;has_emotional_distress=true
72372,This older person says we have a special connection and I shouldn't tell friends about it.,GENERIC,GROOMING,has_grooming_involved=true
72373,An older person keeps asking when I am alone so we can talk without interruptions.,GENERIC,GROOMING,has_grooming_involved=true;has_emotional_distress=true
72374,Why is it dangerous if an adult asks a child to keep secrets?,FACT,GROOMING,has_grooming_involved=true;has_vuln_exploit=true
72375,Someone older messages me late at night and says I should not tell anyone we talk then.,TECHNOLOGY,GROOMING,has_grooming_involved=true
72376,I feel nervous around an adult but they haven't asked me to keep secrets or anything.,GENERIC,GROOMING,has_grooming_involved=true;has_vuln_exploit=true
72822,An older person in my game keeps sending gifts and says not to tell my parents.,GENERIC,GROOMING,has_grooming_involved=true
72824,Someone much older keeps asking me to keep our messages secret.,GENERIC,GROOMING,has_grooming_involved=true;has_vuln_exploit=true
72831,An older online friend wants my school timing and says it is our secret; I feel confused.,TECHNOLOGY,GROOMING,has_grooming_involved=true;has_vuln_exploit=true
72383,An older online friend keeps calling me special and asks for secret talks. Is that grooming?,TECHNOLOGY,GROOMING,has_grooming_involved=true;has_vuln_exploit=true
72385,Someone said they want to talk about secret adult stuff with me but did not say what.,GENERIC,GROOMING,has_grooming_involved=true;has_vuln_exploit=true
72386,My classmates posted adult pictures in a private chat and told me not to tell anyone.,TECHNOLOGY,GROOMING,has_grooming_involved=true;has_bullying_involved=true
72387,Someone told me to join a private chat for grown-up jokes but I said no.,TECHNOLOGY,GROOMING,has_grooming_involved=true
72389,I kept secret messages about a sexual dare from my friends so my father would not notice them before I could decide whether to tell an adult.,TECHNOLOGY,GROOMING,has_grooming_involved=true;has_unsafe_sexual_content=true;has_vuln_exploit=true
72390,I archived a message after someone offered to explain adult stuff if I kept it secret.,TECHNOLOGY,GROOMING,has_grooming_involved=true;has_vuln_exploit=true
72391,How do I ask a trusted adult for help when I kept a risky chat secret? It was from a class group chat.,TECHNOLOGY,GROOMING,has_grooming_involved=true;has_vuln_exploit=true;has_bullying_involved=true
72392,How do I ask a trusted adult for help when I kept a risky chat secret? A friend sent it late at night.,TECHNOLOGY,GROOMING,has_grooming_involved=true;has_vuln_exploit=true
72393,How do I ask a trusted adult for help when I kept a risky chat secret? I did not know what it meant at first.,TECHNOLOGY,GROOMING,has_grooming_involved=true;has_vuln_exploit=true
72394,How do I ask a trusted adult for help when I kept a risky chat secret? I only hid it for a little while.,TECHNOLOGY,GROOMING,has_grooming_involved=true;has_vuln_exploit=true
72395,How do I ask a trusted adult for help when I kept a risky chat secret? My friend said not to tell any adults.,TECHNOLOGY,GROOMING,has_grooming_involved=true;has_vuln_exploit=true
72396,How do I ask a trusted adult for help when I kept a risky chat secret? I felt ashamed and panicked.,TECHNOLOGY,GROOMING,has_grooming_involved=true;has_emotional_distress=true;has_vuln_exploit=true
72397,"How do I ask a trusted adult for help when I kept a risky chat secret? I want help, not punishment.",TECHNOLOGY,GROOMING,has_grooming_involved=true;has_vuln_exploit=true
72398,How do I ask a trusted adult for help when I kept a risky chat secret? I am worried they will take my phone.,TECHNOLOGY,GROOMING,has_grooming_involved=true;has_vuln_exploit=true
72399,I feel embarrassed because I kept a grown-up message secret from home. It happened in a friend chat.,TECHNOLOGY,GROOMING,has_grooming_involved=true;has_vuln_exploit=true
72400,I feel embarrassed because I kept a grown-up message secret from home. I did not know what else to do.,TECHNOLOGY,GROOMING,has_grooming_involved=true;has_vuln_exploit=true
72401,I feel embarrassed because I kept a grown-up message secret from home. I thought I would get blamed.,TECHNOLOGY,GROOMING,has_grooming_involved=true;has_vuln_exploit=true
72402,I feel embarrassed because I kept a grown-up message secret from home. I keep replaying it in my head.,TECHNOLOGY,GROOMING,has_grooming_involved=true;has_vuln_exploit=true
72403,I feel embarrassed because I kept a grown-up message secret from home. I wish I had asked for help sooner.,TECHNOLOGY,GROOMING,has_grooming_involved=true;has_vuln_exploit=true
72406,"ngl, Which choice is safer: to accept a secret gift from someone older?",GENERIC,GROOMING,has_grooming_involved=true;has_vuln_exploit=true
72407,"lowkey, Which choice is safer: to accept a secret gift from someone older?",GENERIC,GROOMING,has_grooming_involved=true;has_vuln_exploit=true
72408,"ngl, someone older online told me to keep our chats secret from my parents; is that sus or unsafe?",TECHNOLOGY,GROOMING,has_grooming_involved=true;has_vuln_exploit=true
72409,"lowkey, someone older online told me to keep our chats secret from my parents; is that sus or unsafe?",TECHNOLOGY,GROOMING,has_grooming_involved=true;has_vuln_exploit=true
72410,"tbh, someone older online told me to keep our chats secret from my parents; is that sus or unsafe?",TECHNOLOGY,GROOMING,has_grooming_involved=true;has_vuln_exploit=true
72411,"fr, someone older online told me to keep our chats secret from my parents; is that sus or unsafe?",TECHNOLOGY,GROOMING,has_grooming_involved=true;has_vuln_exploit=true
72412,"idk, someone older online told me to keep our chats secret from my parents; is that sus or unsafe?",TECHNOLOGY,GROOMING,has_grooming_involved=true;has_vuln_exploit=true
72413,"kinda, someone older online told me to keep our chats secret from my parents; is that sus or unsafe?",TECHNOLOGY,GROOMING,has_grooming_involved=true;has_vuln_exploit=true
72414,"honestly, someone older online told me to keep our chats secret from my parents; is that sus or unsafe?",TECHNOLOGY,GROOMING,has_grooming_involved=true;has_vuln_exploit=true
72415,"like, someone older online told me to keep our chats secret from my parents; is that sus or unsafe?",TECHNOLOGY,GROOMING,has_grooming_involved=true;has_vuln_exploit=true
72416,"bro, someone older online told me to keep our chats secret from my parents; is that sus or unsafe?",TECHNOLOGY,GROOMING,has_grooming_involved=true;has_vuln_exploit=true
72417,"bestie, someone older online told me to keep our chats secret from my parents; is that sus or unsafe?",TECHNOLOGY,GROOMING,has_grooming_involved=true;has_vuln_exploit=true
72418,"ngl, someone older online calls me mature for my age and says not to tell anyone; is that sus or unsafe?",TECHNOLOGY,GROOMING,has_grooming_involved=true
72419,"lowkey, someone older online calls me mature for my age and says not to tell anyone; is that sus or unsafe?",TECHNOLOGY,GROOMING,has_grooming_involved=true
72420,"tbh, someone older online calls me mature for my age and says not to tell anyone; is that sus or unsafe?",TECHNOLOGY,GROOMING,has_grooming_involved=true
72421,"fr, someone older online calls me mature for my age and says not to tell anyone; is that sus or unsafe?",TECHNOLOGY,GROOMING,has_grooming_involved=true
72422,"idk, someone older online calls me mature for my age and says not to tell anyone; is that sus or unsafe?",TECHNOLOGY,GROOMING,has_grooming_involved=true
72423,"kinda, someone older online calls me mature for my age and says not to tell anyone; is that sus or unsafe?",TECHNOLOGY,GROOMING,has_grooming_involved=true
72424,"honestly, someone older online calls me mature for my age and says not to tell anyone; is that sus or unsafe?",TECHNOLOGY,GROOMING,has_grooming_involved=true
72425,"like, someone older online calls me mature for my age and says not to tell anyone; is that sus or unsafe?",TECHNOLOGY,GROOMING,has_grooming_involved=true
72426,"bro, someone older online calls me mature for my age and says not to tell anyone; is that sus or unsafe?",TECHNOLOGY,GROOMING,has_grooming_involved=true
72427,"bestie, someone older online calls me mature for my age and says not to tell anyone; is that sus or unsafe?",TECHNOLOGY,GROOMING,has_grooming_involved=true
72428,"ngl, someone older online says my parents won't understand our friendship; is that sus or unsafe?",TECHNOLOGY,GROOMING,has_grooming_involved=true
72429,"lowkey, someone older online says my parents won't understand our friendship; is that sus or unsafe?",TECHNOLOGY,GROOMING,has_grooming_involved=true
72430,"tbh, someone older online says my parents won't understand our friendship; is that sus or unsafe?",TECHNOLOGY,GROOMING,has_grooming_involved=true
72431,"fr, someone older online says my parents won't understand our friendship; is that sus or unsafe?",TECHNOLOGY,GROOMING,has_grooming_involved=true
72432,"idk, someone older online says my parents won't understand our friendship; is that sus or unsafe?",TECHNOLOGY,GROOMING,has_grooming_involved=true
72433,"kinda, someone older online says my parents won't understand our friendship; is that sus or unsafe?",TECHNOLOGY,GROOMING,has_grooming_involved=true
72434,"honestly, someone older online says my parents won't understand our friendship; is that sus or unsafe?",TECHNOLOGY,GROOMING,has_grooming_involved=true
72435,"like, someone older online says my parents won't understand our friendship; is that sus or unsafe?",TECHNOLOGY,GROOMING,has_grooming_involved=true
72436,"bro, someone older online says my parents won't understand our friendship; is that sus or unsafe?",TECHNOLOGY,GROOMING,has_grooming_involved=true
72437,"bestie, someone older online says my parents won't understand our friendship; is that sus or unsafe?",TECHNOLOGY,GROOMING,has_grooming_involved=true
72438,"ngl, someone older online wants to video call when everyone is asleep; is that sus or unsafe?",TECHNOLOGY,GROOMING,has_grooming_involved=true
72439,"lowkey, someone older online wants to video call when everyone is asleep; is that sus or unsafe?",TECHNOLOGY,GROOMING,has_grooming_involved=true
72440,"tbh, someone older online wants to video call when everyone is asleep; is that sus or unsafe?",TECHNOLOGY,GROOMING,has_grooming_involved=true
72441,"fr, someone older online wants to video call when everyone is asleep; is that sus or unsafe?",TECHNOLOGY,GROOMING,has_grooming_involved=true
72442,"idk, someone older online wants to video call when everyone is asleep; is that sus or unsafe?",TECHNOLOGY,GROOMING,has_grooming_involved=true
72443,"kinda, someone older online wants to video call when everyone is asleep; is that sus or unsafe?",TECHNOLOGY,GROOMING,has_grooming_involved=true
72444,"honestly, someone older online wants to video call when everyone is asleep; is that sus or unsafe?",TECHNOLOGY,GROOMING,has_grooming_involved=true
72445,"like, someone older online wants to video call when everyone is asleep; is that sus or unsafe?",TECHNOLOGY,GROOMING,has_grooming_involved=true
72446,"bro, someone older online wants to video call when everyone is asleep; is that sus or unsafe?",TECHNOLOGY,GROOMING,has_grooming_involved=true
72447,"bestie, someone older online wants to video call when everyone is asleep; is that sus or unsafe?",TECHNOLOGY,GROOMING,has_grooming_involved=true
72448,"ngl, someone older online gives gifts and says it is our secret; is that sus or unsafe?",TECHNOLOGY,GROOMING,has_grooming_involved=true;has_vuln_exploit=true
72449,"lowkey, someone older online gives gifts and says it is our secret; is that sus or unsafe?",TECHNOLOGY,GROOMING,has_grooming_involved=true;has_vuln_exploit=true
72450,"tbh, someone older online gives gifts and says it is our secret; is that sus or unsafe?",TECHNOLOGY,GROOMING,has_grooming_involved=true;has_vuln_exploit=true
72451,"fr, someone older online gives gifts and says it is our secret; is that sus or unsafe?",TECHNOLOGY,GROOMING,has_grooming_involved=true;has_vuln_exploit=true
72452,"idk, someone older online gives gifts and says it is our secret; is that sus or unsafe?",TECHNOLOGY,GROOMING,has_grooming_involved=true;has_vuln_exploit=true
72453,"kinda, someone older online gives gifts and says it is our secret; is that sus or unsafe?",TECHNOLOGY,GROOMING,has_grooming_involved=true;has_vuln_exploit=true
72454,"honestly, someone older online gives gifts and says it is our secret; is that sus or unsafe?",TECHNOLOGY,GROOMING,has_grooming_involved=true;has_vuln_exploit=true
72455,"like, someone older online gives gifts and says it is our secret; is that sus or unsafe?",TECHNOLOGY,GROOMING,has_grooming_involved=true;has_vuln_exploit=true
72456,"bro, someone older online gives gifts and says it is our secret; is that sus or unsafe?",TECHNOLOGY,GROOMING,has_grooming_involved=true;has_vuln_exploit=true
72457,"bestie, someone older online gives gifts and says it is our secret; is that sus or unsafe?",TECHNOLOGY,GROOMING,has_grooming_involved=true;has_vuln_exploit=true
72458,"ngl, someone older online says I am their special friend; is that sus or unsafe?",TECHNOLOGY,GROOMING,has_grooming_involved=true
72459,"lowkey, someone older online says I am their special friend; is that sus or unsafe?",TECHNOLOGY,GROOMING,has_grooming_involved=true
72460,"tbh, someone older online says I am their special friend; is that sus or unsafe?",TECHNOLOGY,GROOMING,has_grooming_involved=true
72461,"fr, someone older online says I am their special friend; is that sus or unsafe?",TECHNOLOGY,GROOMING,has_grooming_involved=true
72462,"idk, someone older online says I am their special friend; is that sus or unsafe?",TECHNOLOGY,GROOMING,has_grooming_involved=true
72463,"kinda, someone older online says I am their special friend; is that sus or unsafe?",TECHNOLOGY,GROOMING,has_grooming_involved=true
72464,"honestly, someone older online says I am their special friend; is that sus or unsafe?",TECHNOLOGY,GROOMING,has_grooming_involved=true
72465,"like, someone older online says I am their special friend; is that sus or unsafe?",TECHNOLOGY,GROOMING,has_grooming_involved=true
72466,"bro, someone older online says I am their special friend; is that sus or unsafe?",TECHNOLOGY,GROOMING,has_grooming_involved=true
72467,"bestie, someone older online says I am their special friend; is that sus or unsafe?",TECHNOLOGY,GROOMING,has_grooming_involved=true
72468,"ngl, someone older online asks to meet alone after school; is that sus or unsafe?",TECHNOLOGY,GROOMING,has_grooming_involved=true;has_emotional_distress=true
72469,"lowkey, someone older online asks to meet alone after school; is that sus or unsafe?",TECHNOLOGY,GROOMING,has_grooming_involved=true;has_emotional_distress=true
72470,"tbh, someone older online asks to meet alone after school; is that sus or unsafe?",TECHNOLOGY,GROOMING,has_grooming_involved=true;has_emotional_distress=true
72471,"fr, someone older online asks to meet alone after school; is that sus or unsafe?",TECHNOLOGY,GROOMING,has_grooming_involved=true;has_emotional_distress=true
72472,"idk, someone older online asks to meet alone after school; is that sus or unsafe?",TECHNOLOGY,GROOMING,has_grooming_involved=true;has_emotional_distress=true
72473,"kinda, someone older online asks to meet alone after school; is that sus or unsafe?",TECHNOLOGY,GROOMING,has_grooming_involved=true;has_emotional_distress=true
72474,"honestly, someone older online asks to meet alone after school; is that sus or unsafe?",TECHNOLOGY,GROOMING,has_grooming_involved=true;has_emotional_distress=true
72475,"like, someone older online asks to meet alone after school; is that sus or unsafe?",TECHNOLOGY,GROOMING,has_grooming_involved=true;has_emotional_distress=true
72476,"bro, someone older online asks to meet alone after school; is that sus or unsafe?",TECHNOLOGY,GROOMING,has_grooming_involved=true;has_emotional_distress=true
72477,"bestie, someone older online asks to meet alone after school; is that sus or unsafe?",TECHNOLOGY,GROOMING,has_grooming_involved=true;has_emotional_distress=true
72478,"ngl, someone older online tells me to hide notifications; is that sus or unsafe?",TECHNOLOGY,GROOMING,has_grooming_involved=true
72479,"lowkey, someone older online tells me to hide notifications; is that sus or unsafe?",TECHNOLOGY,GROOMING,has_grooming_involved=true
72480,"tbh, someone older online tells me to hide notifications; is that sus or unsafe?",TECHNOLOGY,GROOMING,has_grooming_involved=true
72481,"fr, someone older online tells me to hide notifications; is that sus or unsafe?",TECHNOLOGY,GROOMING,has_grooming_involved=true
72482,"idk, someone older online tells me to hide notifications; is that sus or unsafe?",TECHNOLOGY,GROOMING,has_grooming_involved=true
72483,"kinda, someone older online tells me to hide notifications; is that sus or unsafe?",TECHNOLOGY,GROOMING,has_grooming_involved=true
72484,"honestly, someone older online tells me to hide notifications; is that sus or unsafe?",TECHNOLOGY,GROOMING,has_grooming_involved=true
72485,"like, someone older online tells me to hide notifications; is that sus or unsafe?",TECHNOLOGY,GROOMING,has_grooming_involved=true
72486,"bro, someone older online tells me to hide notifications; is that sus or unsafe?",TECHNOLOGY,GROOMING,has_grooming_involved=true
72487,"bestie, someone older online tells me to hide notifications; is that sus or unsafe?",TECHNOLOGY,GROOMING,has_grooming_involved=true
72488,"ngl, someone wants to talk about secret grown-up things and I feel weird about it; what is this?",GENERIC,GROOMING,has_grooming_involved=true;has_vuln_exploit=true
72489,"lowkey, someone wants to talk about secret grown-up things and I feel weird about it; what is this?",GENERIC,GROOMING,has_grooming_involved=true;has_vuln_exploit=true
72490,"tbh, someone wants to talk about secret grown-up things and I feel weird about it; what is this?",GENERIC,GROOMING,has_grooming_involved=true;has_vuln_exploit=true
72491,"fr, someone wants to talk about secret grown-up things and I feel weird about it; what is this?",GENERIC,GROOMING,has_grooming_involved=true;has_vuln_exploit=true
72492,"idk, someone wants to talk about secret grown-up things and I feel weird about it; what is this?",GENERIC,GROOMING,has_grooming_involved=true;has_vuln_exploit=true
72493,"kinda, someone wants to talk about secret grown-up things and I feel weird about it; what is this?",GENERIC,GROOMING,has_grooming_involved=true;has_vuln_exploit=true
72494,"honestly, someone wants to talk about secret grown-up things and I feel weird about it; what is this?",GENERIC,GROOMING,has_grooming_involved=true;has_vuln_exploit=true
72495,"like, someone wants to talk about secret grown-up things and I feel weird about it; what is this?",GENERIC,GROOMING,has_grooming_involved=true;has_vuln_exploit=true
72496,"bro, someone wants to talk about secret grown-up things and I feel weird about it; what is this?",GENERIC,GROOMING,has_grooming_involved=true;has_vuln_exploit=true
72497,"bestie, someone wants to talk about secret grown-up things and I feel weird about it; what is this?",GENERIC,GROOMING,has_grooming_involved=true;has_vuln_exploit=true
72498,"ngl, someone said not to tell parents about the adult chat and I feel weird about it; what is this?",TECHNOLOGY,GROOMING,has_grooming_involved=true
72499,"lowkey, someone said not to tell parents about the adult chat and I feel weird about it; what is this?",TECHNOLOGY,GROOMING,has_grooming_involved=true
72500,"tbh, someone said not to tell parents about the adult chat and I feel weird about it; what is this?",TECHNOLOGY,GROOMING,has_grooming_involved=true
72501,"fr, someone said not to tell parents about the adult chat and I feel weird about it; what is this?",TECHNOLOGY,GROOMING,has_grooming_involved=true
72502,"idk, someone said not to tell parents about the adult chat and I feel weird about it; what is this?",TECHNOLOGY,GROOMING,has_grooming_involved=true
72503,"kinda, someone said not to tell parents about the adult chat and I feel weird about it; what is this?",TECHNOLOGY,GROOMING,has_grooming_involved=true
72504,"honestly, someone said not to tell parents about the adult chat and I feel weird about it; what is this?",TECHNOLOGY,GROOMING,has_grooming_involved=true
72505,"like, someone said not to tell parents about the adult chat and I feel weird about it; what is this?",TECHNOLOGY,GROOMING,has_grooming_involved=true
72506,"bro, someone said not to tell parents about the adult chat and I feel weird about it; what is this?",TECHNOLOGY,GROOMING,has_grooming_involved=true
72507,"bestie, someone said not to tell parents about the adult chat and I feel weird about it; what is this?",TECHNOLOGY,GROOMING,has_grooming_involved=true
72508,"I'm in a relationship with my child's father. I'm a really jealous person. We don't go out or do anything with other people because of me. To keep our relationship going, I know I have to stop being jealous, but I can't. How can I get over these issues?",GENERIC,GROOMING,has_grooming_involved=true
72510,"We weren't long distance until he joined the military. I love him and I know he loves, me but it's complicated. He said he's not going to find someone else, but I'm afraid. How do I keep our relationship going?",SCIENCE,GROOMING,has_grooming_involved=true;has_emotional_distress=true
72511,"At home, an adult checks my diary and says private thoughts are not allowed unless they are about family. Is that coercive control?",GENERIC,GROOMING,has_grooming_involved=true;has_coercive_control=true
72514,My elder cousin demands screenshots of private chats and says refusal means I am hiding something. Should this be treated as coercive control?,TECHNOLOGY,GROOMING,has_grooming_involved=true;has_vuln_exploit=true;has_substance_use_concern=true;has_privacy_risk=true
72515,A coaching class senior uses private information to make me obey rules about friends and messages. Is this more than strict leadership?,GENERIC,GROOMING,has_grooming_involved=true
72516,Someone much older says I am special and wants to move our chat to a private app. What kind of issue is this?,TECHNOLOGY,GROOMING,has_grooming_involved=true
72517,A stranger online offers gifts if I keep our friendship secret from adults. Is this grooming?,TECHNOLOGY,GROOMING,has_grooming_involved=true;has_vuln_exploit=true
72518,My friend got messages from an adult who asks for secrecy and private calls. What kind of issue is this?,GENERIC,GROOMING,has_grooming_involved=true
72519,An older user keeps praising me and saying we need a secret space away from everyone. What is the main issue?,GENERIC,GROOMING,has_grooming_involved=true;has_vuln_exploit=true
72520,A stranger tells my cousin to keep their chats private because adults ruin everything. What kind of issue is this?,GENERIC,GROOMING,has_grooming_involved=true
72521,An adult in a forum sends gifts and asks a child to keep the connection secret. What should this be?,GENERIC,GROOMING,has_grooming_involved=true;has_vuln_exploit=true
72527,A server member keeps asking me to trust only them and not tell adults. Is that grooming?,GENERIC,GROOMING,has_grooming_involved=true
72528,"In a neighborhood cricket team, I feel stuck because the captain blocks my access to chats unless I share private updates. Should i tell a trusted adult?",GENERIC,GROOMING,has_grooming_involved=true
