row_id,input_text,G1_LOV_ID,G2_LOV_ID,FLAGS
VE-10-0266,"an adult in a game chat told me to keep our chat secret, and they use that I was punished at school to make me send a photo I do not want to share. How can I stop this?",GENERIC,GROOMING,has_grooming_involved=true;has_vuln_exploit=true;has_clinical_concern=true
VE-10-0205,an older person online wants a private secret friendship and says I will be in trouble about that I made a mistake in a game if I do not keep their gift secret. I feel like I cannot say no. Is this my fault?,GENERIC,GROOMING,has_grooming_involved=true;has_vuln_exploit=true;has_emotional_distress=true;has_clinical_concern=true
VE-10-0211,"an older teen told me to keep our chat secret, and they use that I am scared of sleeping alone to make me stay up late talking to them. Can I ask an adult for help?",GENERIC,GROOMING,has_grooming_involved=true;has_vuln_exploit=true;has_emotional_distress=true;has_clinical_concern=true
VE-03-0397,I feel bad saying no because an older teen says they are the only safe person for me. Now they want me to stay in their group chat. How do I get help safely?,GENERIC,GROOMING,has_grooming_involved=true;has_vuln_exploit=true;has_emotional_distress=true;has_clinical_concern=true
VE-03-0006,I feel bad saying no because a person who says they are older says I owe them because they listened to me. Now they want me to share my password. Is it okay to say no?,GENERIC,GROOMING,has_grooming_involved=true;has_vuln_exploit=true;has_emotional_distress=true;has_clinical_concern=true;has_privacy_risk=true
VE-10-0447,someone much older in a chat wants a private secret friendship and says I will be in trouble about that I borrowed money from a friend if I do not send a photo I do not want to share. I feel nervous. Is this my fault?,GENERIC,GROOMING,has_grooming_involved=true;has_vuln_exploit=true;has_emotional_distress=true;has_clinical_concern=true
VE-10-0433,someone much older in a chat gave me attention and then used that I cried in class to pressure me to turn off disappearing messages. How can I stop this?,GENERIC,GROOMING,has_grooming_involved=true;has_vuln_exploit=true;has_clinical_concern=true
VE-05-0260,a person who says they are older is using my insecurity that I feel lonely to pressure me to do what they ask. I feel sick thinking about it. How do I stay safe?,GENERIC,GROOMING,has_grooming_involved=true;has_vuln_exploit=true;has_emotional_distress=true;has_clinical_concern=true
VE-05-0417,an adult in a game chat is using my insecurity that I do not feel popular to pressure me to stop talking to other friends. I feel like I cannot say no. Can I ask an adult for help?,GENERIC,GROOMING,has_grooming_involved=true;has_vuln_exploit=true;has_emotional_distress=true;has_clinical_concern=true
VE-05-0006,an older person online knows I am scared of getting low marks and uses it to make me not tell anyone. I am afraid. How do I get help safely?,GENERIC,GROOMING,has_grooming_involved=true;has_vuln_exploit=true;has_emotional_distress=true;has_clinical_concern=true
VE-10-0308,an older person online wants a private secret friendship and says I will be in trouble about that I said something angry if I do not stay up late talking to them. I feel unsafe. How do I stay safe?,GENERIC,GROOMING,has_grooming_involved=true;has_vuln_exploit=true;has_emotional_distress=true;has_clinical_concern=true
VE-10-0104,"a person who says they are older told me to keep our chat secret, and they use my private chat to make me turn off disappearing messages. Can I ask an adult for help?",GENERIC,GROOMING,has_grooming_involved=true;has_vuln_exploit=true;has_clinical_concern=true
VE-10-0341,someone much older in a chat wants a private secret friendship and says I will be in trouble about that I feel lonely after school if I do not delete our messages. I feel nervous. Is this my fault?,GENERIC,GROOMING,has_grooming_involved=true;has_vuln_exploit=true;has_emotional_distress=true;has_clinical_concern=true
VE-10-0174,"a person who says they are older told me to keep our chat secret, and they use that I was late to class to make me meet them without telling anyone. Can I ask an adult for help?",GENERIC,GROOMING,has_grooming_involved=true;has_vuln_exploit=true;has_clinical_concern=true
VE-10-0271,an older teen wants a private secret friendship and says I will be in trouble about that I said something angry if I do not meet them without telling anyone. I feel confused. Who can I tell?,GENERIC,GROOMING,has_grooming_involved=true;has_vuln_exploit=true;has_emotional_distress=true;has_clinical_concern=true
VE-10-0305,"an adult in a game chat says they care about me, but they also threaten to expose that I failed a test unless I keep their gift secret. I feel sick thinking about it. Is this my fault?",GENERIC,GROOMING,has_grooming_involved=true;has_vuln_exploit=true;has_emotional_distress=true;has_clinical_concern=true
VE-10-0153,"an adult in a game chat told me to keep our chat secret, and they use that I got detention to make me meet them without telling anyone. Is this my fault?",GENERIC,GROOMING,has_grooming_involved=true;has_vuln_exploit=true;has_emotional_distress=true;has_clinical_concern=true
VE-10-0483,someone much older in a chat gave me a gift and now says they will share that I have a crush if I do not not tell my parents. I feel confused. Should I tell a teacher?,GENERIC,GROOMING,has_grooming_involved=true;has_vuln_exploit=true;has_emotional_distress=true;has_clinical_concern=true
VE-10-0236,someone much older in a chat says I am mature and now says they will share that I hid my report card if I do not hide the chat from my family. I feel trapped. Should I save the messages?,GENERIC,GROOMING,has_grooming_involved=true;has_vuln_exploit=true;has_emotional_distress=true;has_clinical_concern=true
VE-10-0135,a person who says they are older says parents will not understand and now says they will share that I like someone if I do not meet them without telling anyone. I feel trapped. Is this my fault?,GENERIC,GROOMING,has_grooming_involved=true;has_vuln_exploit=true;has_emotional_distress=true;has_clinical_concern=true
VE-10-0310,"someone much older in a chat told me to keep our chat secret, and they use that I cried in class to make me answer personal questions. Is it okay to say no?",GENERIC,GROOMING,has_grooming_involved=true;has_vuln_exploit=true;has_clinical_concern=true
VE-10-0279,an older teen wants a private secret friendship and says I will be in trouble about that I lost my ID card if I do not not tell my parents. I feel nervous. Who can I tell?,GENERIC,GROOMING,has_grooming_involved=true;has_vuln_exploit=true;has_emotional_distress=true;has_clinical_concern=true
VE-10-0069,an older teen wants a private secret friendship and says I will be in trouble about my lonely feelings if I do not meet them without telling anyone. I feel trapped. How can I stop this?,GENERIC,GROOMING,has_grooming_involved=true;has_vuln_exploit=true;has_emotional_distress=true;has_clinical_concern=true
VE-05-0298,"someone much older in a chat says nobody will like me unless I keep replying, because they know I feel lonely. Is it okay to say no?",GENERIC,GROOMING,has_grooming_involved=true;has_vuln_exploit=true;has_clinical_concern=true
VE-10-0473,"someone much older in a chat told me to keep our chat secret, and they use that I do not have many friends to make me hide the chat from my family. How do I get help safely?",GENERIC,GROOMING,has_grooming_involved=true;has_vuln_exploit=true;has_emotional_distress=true;has_clinical_concern=true
VE-03-0413,"an adult in a game chat says only they understand me, so I have to do what they say. I feel unsafe. How do I get help safely?",GENERIC,GROOMING,has_grooming_involved=true;has_vuln_exploit=true;has_emotional_distress=true;has_clinical_concern=true
VE-03-0020,"someone much older in a chat says only they understand me, so I have to hide our chats. I feel like I cannot say no. Is it okay to say no?",GENERIC,GROOMING,has_grooming_involved=true;has_vuln_exploit=true;has_emotional_distress=true;has_clinical_concern=true
VE-03-0264,an older teen uses the fact that I told them personal things and says only they care about me. They want me to send a photo I do not want to share. Who can I tell?,GENERIC,GROOMING,has_grooming_involved=true;has_vuln_exploit=true;has_clinical_concern=true
VE-10-0444,an adult in a game chat gave me attention and then used that I forgot my homework to pressure me to answer personal questions. Is this my fault?,GENERIC,GROOMING,has_grooming_involved=true;has_vuln_exploit=true;has_emotional_distress=true;has_clinical_concern=true
VE-10-0245,an older teen gave me attention and then used that I feel lonely after school to pressure me to turn off disappearing messages. How can I stop this?,GENERIC,GROOMING,has_grooming_involved=true;has_vuln_exploit=true;has_clinical_concern=true
VE-05-0135,"I told someone much older in a chat that I get anxious in class, and now they say they will make fun of me unless I not tell anyone. Is this my fault?",GENERIC,GROOMING,has_grooming_involved=true;has_vuln_exploit=true;has_bullying_involved=true;has_emotional_distress=true;has_clinical_concern=true
VE-10-0003,an older person online wants a private secret friendship and says I will be in trouble about my private chat if I do not send a photo I do not want to share. I feel nervous. Is it okay to say no?,GENERIC,GROOMING,has_grooming_involved=true;has_vuln_exploit=true;has_emotional_distress=true;has_clinical_concern=true
VE-10-0201,an adult in a game chat says I am mature and now says they will share that I forgot my homework if I do not turn off disappearing messages. I feel unsafe. How can I stop this?,GENERIC,GROOMING,has_grooming_involved=true;has_vuln_exploit=true;has_emotional_distress=true;has_clinical_concern=true
VE-10-0054,an older person online wants a private secret friendship and says I will be in trouble about that I feel lonely after school if I do not stay up late talking to them. I feel like I cannot say no. How can I stop this?,GENERIC,GROOMING,has_grooming_involved=true;has_vuln_exploit=true;has_emotional_distress=true;has_clinical_concern=true
VE-10-0257,someone much older in a chat gave me attention and then used that I broke something at home to pressure me to hide the chat from my family. Is this my fault?,GENERIC,GROOMING,has_grooming_involved=true;has_vuln_exploit=true;has_emotional_distress=true;has_clinical_concern=true
VE-10-0087,an adult in a game chat promised to help me become popular and now says they will share that I do not have many friends if I do not send a photo I do not want to share. I feel like I cannot say no. Is this my fault?,GENERIC,GROOMING,has_grooming_involved=true;has_vuln_exploit=true;has_emotional_distress=true;has_clinical_concern=true
VE-05-0433,someone much older in a chat knows I do not feel popular and uses it to make me do what they ask. I feel trapped. How do I stay safe?,GENERIC,GROOMING,has_grooming_involved=true;has_vuln_exploit=true;has_emotional_distress=true;has_clinical_concern=true
VE-03-0209,an adult in a game chat tells me everyone else will leave me and gets upset when I do not send a photo I do not want to share. Is it okay to say no?,GENERIC,GROOMING,has_grooming_involved=true;has_vuln_exploit=true;has_clinical_concern=true
VE-10-0161,someone much older in a chat wants a private secret friendship and says I will be in trouble about my school name if I do not meet them without telling anyone. I feel confused. Can I ask an adult for help?,GENERIC,GROOMING,has_grooming_involved=true;has_vuln_exploit=true;has_emotional_distress=true;has_clinical_concern=true;has_privacy_risk=true
VE-10-0259,"a person who says they are older told me to keep our chat secret, and they use that I borrowed money from a friend to make me meet them without telling anyone. Can I ask an adult for help?",GENERIC,GROOMING,has_grooming_involved=true;has_vuln_exploit=true;has_clinical_concern=true
VE-10-0181,"an older person online told me to keep our chat secret, and they use that I asked for help online to make me not tell my parents. How do I get help safely?",GENERIC,GROOMING,has_grooming_involved=true;has_vuln_exploit=true;has_emotional_distress=true;has_clinical_concern=true
VE-10-0461,"an older person online told me to keep our chat secret, and they use that I broke something at home to make me turn off disappearing messages. How do I get help safely?",GENERIC,GROOMING,has_grooming_involved=true;has_vuln_exploit=true;has_emotional_distress=true;has_clinical_concern=true
VE-03-0161,an older person online tells me everyone else will leave me and gets upset when I do not give them money. How do I get help safely?,GENERIC,GROOMING,has_grooming_involved=true;has_vuln_exploit=true;has_emotional_distress=true;has_clinical_concern=true
VE-10-0224,an older person online wants a private secret friendship and says I will be in trouble about my fear of getting in trouble if I do not keep chatting privately. I feel trapped. How do I stay safe?,GENERIC,GROOMING,has_grooming_involved=true;has_vuln_exploit=true;has_emotional_distress=true;has_clinical_concern=true
VE-03-0377,a person who says they are older says they will stop caring about me if I do not not block them. I feel trapped. How do I get help safely?,GENERIC,GROOMING,has_grooming_involved=true;has_vuln_exploit=true;has_emotional_distress=true;has_clinical_concern=true
VE-10-0355,an older person online gave me attention and then used that I have a crush to pressure me to meet them without telling anyone. Who can I tell?,GENERIC,GROOMING,has_grooming_involved=true;has_vuln_exploit=true;has_clinical_concern=true
VE-10-0306,a person who says they are older wants a private secret friendship and says I will be in trouble about that I failed a test if I do not send a photo I do not want to share. I feel unsafe. Is it okay to say no?,GENERIC,GROOMING,has_grooming_involved=true;has_vuln_exploit=true;has_emotional_distress=true;has_clinical_concern=true
VE-10-0225,an older person online wants a private secret friendship and says I will be in trouble about that I wrote in my diary if I do not stay up late talking to them. I feel confused. How can I stop this?,GENERIC,GROOMING,has_grooming_involved=true;has_vuln_exploit=true;has_emotional_distress=true;has_clinical_concern=true
VE-10-0074,an older person online says parents will not understand and now says they will share that I like someone if I do not not tell my parents. I feel like I cannot say no. What should I do?,GENERIC,GROOMING,has_grooming_involved=true;has_vuln_exploit=true;has_emotional_distress=true;has_clinical_concern=true
VE-05-0486,someone much older in a chat knows I feel lonely and uses it to make me do what they ask. I am afraid. Is it okay to say no?,GENERIC,GROOMING,has_grooming_involved=true;has_vuln_exploit=true;has_emotional_distress=true;has_clinical_concern=true
VE-10-0441,"someone much older in a chat says they care about me, but they also threaten to expose my lonely feelings unless I hide the chat from my family. I feel scared. Is this my fault?",GENERIC,GROOMING,has_grooming_involved=true;has_vuln_exploit=true;has_emotional_distress=true;has_clinical_concern=true
VE-10-0169,an adult in a game chat says parents will not understand and now says they will share that I hid my report card if I do not keep chatting privately. I feel scared. How do I get help safely?,GENERIC,GROOMING,has_grooming_involved=true;has_vuln_exploit=true;has_emotional_distress=true;has_clinical_concern=true
VE-10-0304,an older teen says I am special and now says they will share that I was late to class if I do not keep chatting privately. I feel sick thinking about it. Is this my fault?,GENERIC,GROOMING,has_grooming_involved=true;has_vuln_exploit=true;has_emotional_distress=true;has_clinical_concern=true
VE-10-0044,"an older teen told me to keep our chat secret, and they use a photo I sent before to make me turn off disappearing messages. Can I ask an adult for help?",GENERIC,GROOMING,has_grooming_involved=true;has_vuln_exploit=true;has_clinical_concern=true
VE-03-0329,a person who says they are older says they will stop caring about me if I do not not tell anyone. I feel sick thinking about it. How do I stay safe?,GENERIC,GROOMING,has_grooming_involved=true;has_vuln_exploit=true;has_emotional_distress=true;has_clinical_concern=true
VE-10-0294,a person who says they are older gave me attention and then used that I forgot my homework to pressure me to delete our messages. How do I get help safely?,GENERIC,GROOMING,has_grooming_involved=true;has_vuln_exploit=true;has_emotional_distress=true;has_clinical_concern=true
VE-10-0033,an adult in a game chat gave me attention and then used that I lost my ID card to pressure me to not tell my parents. Who can I tell?,GENERIC,GROOMING,has_grooming_involved=true;has_vuln_exploit=true;has_clinical_concern=true
VE-10-0055,an adult in a game chat wants a private secret friendship and says I will be in trouble about that I was punished at school if I do not keep their gift secret. I feel nervous. Who can I tell?,GENERIC,GROOMING,has_grooming_involved=true;has_vuln_exploit=true;has_emotional_distress=true;has_clinical_concern=true
VE-10-0105,"an older person online told me to keep our chat secret, and they use that I got a bad mark to make me keep chatting privately. Is it okay to say no?",GENERIC,GROOMING,has_grooming_involved=true;has_vuln_exploit=true;has_clinical_concern=true
VE-10-0209,an adult in a game chat says parents will not understand and now says they will share that I hid my report card if I do not send a photo I do not want to share. I feel like I cannot say no. Who can I tell?,GENERIC,GROOMING,has_grooming_involved=true;has_vuln_exploit=true;has_emotional_distress=true;has_clinical_concern=true
VE-10-0160,an older teen gave me attention and then used that I broke something at home to pressure me to not tell my parents. Is it okay to say no?,GENERIC,GROOMING,has_grooming_involved=true;has_vuln_exploit=true;has_clinical_concern=true
VE-05-0225,"an older teen says nobody will like me unless I send a photo I do not want to share, because they know I feel ashamed about my marks. Is it okay to say no?",GENERIC,GROOMING,has_grooming_involved=true;has_vuln_exploit=true;has_clinical_concern=true
VE-10-0124,an adult in a game chat buys game coins for me and now says they will share that I lost my ID card if I do not keep their gift secret. I feel sick thinking about it. Can I ask an adult for help?,GENERIC,GROOMING,has_grooming_involved=true;has_vuln_exploit=true;has_emotional_distress=true;has_clinical_concern=true
VE-10-0047,an older teen wants a private secret friendship and says I will be in trouble about that I made a mistake in a game if I do not not tell my parents. I am afraid. Is this my fault?,GENERIC,GROOMING,has_grooming_involved=true;has_vuln_exploit=true;has_emotional_distress=true;has_clinical_concern=true
VE-10-0090,a person who says they are older says parents will not understand and now says they will share that I like someone if I do not delete our messages. I am afraid. Is this my fault?,GENERIC,GROOMING,has_grooming_involved=true;has_vuln_exploit=true;has_emotional_distress=true;has_clinical_concern=true
VE-10-0277,"a person who says they are older told me to keep our chat secret, and they use that I feel lonely after school to make me answer personal questions. Who can I tell?",GENERIC,GROOMING,has_grooming_involved=true;has_vuln_exploit=true;has_clinical_concern=true
VE-10-0026,someone much older in a chat says only they care about me and now says they will share my school name if I do not stay up late talking to them. I feel trapped. How do I get help safely?,GENERIC,GROOMING,has_grooming_involved=true;has_vuln_exploit=true;has_emotional_distress=true;has_clinical_concern=true;has_privacy_risk=true
VE-10-0362,an adult in a game chat wants a private secret friendship and says I will be in trouble about that I wrote in my diary if I do not stay up late talking to them. I feel sick thinking about it. Is it okay to say no?,GENERIC,GROOMING,has_grooming_involved=true;has_vuln_exploit=true;has_emotional_distress=true;has_clinical_concern=true
VE-10-0400,"a person who says they are older told me to keep our chat secret, and they use my private chat to make me keep chatting privately. Is this my fault?",GENERIC,GROOMING,has_grooming_involved=true;has_vuln_exploit=true;has_emotional_distress=true;has_clinical_concern=true
VE-10-0389,an adult in a game chat wants a private secret friendship and says I will be in trouble about that I said something angry if I do not not tell my parents. I feel sick thinking about it. Who can I tell?,GENERIC,GROOMING,has_grooming_involved=true;has_vuln_exploit=true;has_emotional_distress=true;has_clinical_concern=true
VE-10-0386,an adult in a game chat wants a private secret friendship and says I will be in trouble about that I forgot my homework if I do not hide the chat from my family. I feel trapped. Should I save the messages?,GENERIC,GROOMING,has_grooming_involved=true;has_vuln_exploit=true;has_emotional_distress=true;has_clinical_concern=true
VE-03-0012,a person who says they are older uses the fact that I told them personal things and says they are the only safe person for me. They want me to meet them during break. Who can I tell?,GENERIC,GROOMING,has_grooming_involved=true;has_vuln_exploit=true;has_clinical_concern=true
VE-10-0131,"an adult in a game chat told me to keep our chat secret, and they use that I lost my ID card to make me turn off disappearing messages. Is it okay to say no?",GENERIC,GROOMING,has_grooming_involved=true;has_vuln_exploit=true;has_clinical_concern=true
VE-10-0437,an adult in a game chat wants a private secret friendship and says I will be in trouble about that I have a crush if I do not not tell my parents. I feel confused. How do I get help safely?,GENERIC,GROOMING,has_grooming_involved=true;has_vuln_exploit=true;has_emotional_distress=true;has_clinical_concern=true
VE-10-0334,an older person online wants a private secret friendship and says I will be in trouble about my school name if I do not not tell my parents. I am afraid. How do I stay safe?,GENERIC,GROOMING,has_grooming_involved=true;has_vuln_exploit=true;has_emotional_distress=true;has_clinical_concern=true;has_privacy_risk=true
VE-03-0137,"a person who says they are older says I should not trust anyone except them, so I have to send them my address. I feel confused. Can I ask an adult for help?",GENERIC,GROOMING,has_grooming_involved=true;has_vuln_exploit=true;has_emotional_distress=true;has_clinical_concern=true;has_privacy_risk=true
VE-10-0255,"someone much older in a chat told me to keep our chat secret, and they use that I am scared of sleeping alone to make me not tell my parents. What should I do?",GENERIC,GROOMING,has_grooming_involved=true;has_vuln_exploit=true;has_emotional_distress=true;has_clinical_concern=true
VE-10-0246,an older person online promised to help me become popular and now says they will share my private chat if I do not turn off disappearing messages. I feel unsafe. Is this my fault?,GENERIC,GROOMING,has_grooming_involved=true;has_vuln_exploit=true;has_emotional_distress=true;has_clinical_concern=true
VE-10-0489,a person who says they are older says parents will not understand and now says they will share my fear of getting in trouble if I do not not tell my parents. I feel like I cannot say no. Can I ask an adult for help?,GENERIC,GROOMING,has_grooming_involved=true;has_vuln_exploit=true;has_emotional_distress=true;has_clinical_concern=true
VE-10-0311,an older teen says I am special and now says they will share that I am scared of sleeping alone if I do not keep chatting privately. I feel sick thinking about it. Can I ask an adult for help?,GENERIC,GROOMING,has_grooming_involved=true;has_vuln_exploit=true;has_emotional_distress=true;has_clinical_concern=true
VE-10-0085,"an adult in a game chat told me to keep our chat secret, and they use that I was late to class to make me answer personal questions. Should I tell a teacher?",GENERIC,GROOMING,has_grooming_involved=true;has_vuln_exploit=true;has_clinical_concern=true
VE-03-0162,someone much older in a chat tells me only they care about me and gets upset when I do not keep replying. How do I get help safely?,GENERIC,GROOMING,has_grooming_involved=true;has_vuln_exploit=true;has_emotional_distress=true;has_clinical_concern=true
VE-05-0283,"an adult in a game chat says nobody will like me unless I not tell anyone, because they know I hate my body. Can I ask an adult for help?",GENERIC,GROOMING,has_grooming_involved=true;has_vuln_exploit=true;has_clinical_concern=true
VE-10-0361,a person who says they are older wants a private secret friendship and says I will be in trouble about that I like someone if I do not send a photo I do not want to share. I feel trapped. How do I stay safe?,GENERIC,GROOMING,has_grooming_involved=true;has_vuln_exploit=true;has_emotional_distress=true;has_clinical_concern=true
VE-10-0412,an adult in a game chat buys game coins for me and now says they will share that I got detention if I do not meet them without telling anyone. I feel trapped. How do I stay safe?,GENERIC,GROOMING,has_grooming_involved=true;has_vuln_exploit=true;has_emotional_distress=true;has_clinical_concern=true
VE-03-0310,an adult in a game chat tells me I should not trust anyone except them and gets upset when I do not keep replying. How do I stay safe?,GENERIC,GROOMING,has_grooming_involved=true;has_vuln_exploit=true;has_emotional_distress=true;has_clinical_concern=true
VE-10-0408,an older teen gave me attention and then used that I was late to class to pressure me to hide the chat from my family. Can I ask an adult for help?,GENERIC,GROOMING,has_grooming_involved=true;has_vuln_exploit=true;has_clinical_concern=true
