row_id,input_text,G1_LOV_ID,G2_LOV_ID,FLAGS
72664,"my older sibling asks me to keep my status visible during team practice at practice, and I cannot tell if it is care or control.",GENERIC,GROOMING,has_grooming_involved=true
72665,"near the bus stop, my parent wants me to keep the group rule private until adults understand it; I do not know the full reason.",GENERIC,GROOMING,has_grooming_involved=true
72666,"a neighbor's older child wants to see messages after someone posted something hurtful inside the prayer group, and I cannot tell if it is care or control.",GENERIC,GROOMING,has_grooming_involved=true;has_medical_concern=true;has_substance_use_concern=true
72667,An older person online wants to discuss my friend's younger brother privately and says adults should not know.,TECHNOLOGY,GROOMING,has_grooming_involved=true
72668,"Someone with power over me during student council practice says they will make everyone blame my best friend, so I keep doing what they demand. I do not want to keep this secret anymore.",GENERIC,GROOMING,has_grooming_involved=true;has_vuln_exploit=true
72671,"If I do not tell them every place I go, my best friend says they will get my little brother in trouble. on the school photo folder, I feel stuck.",GENERIC,GROOMING,has_grooming_involved=true
72672,During festival practice: a class WhatsApp admin makes me send screenshots of private chats by saying they will turn people against my school friend. I need to know how to talk to a trusted adult.,TECHNOLOGY,GROOMING,has_grooming_involved=true;has_vuln_exploit=true;has_privacy_risk=true
72673,"A rule keeps changing on a private art server, and a volunteer captain says they will make life difficult for my teammate's sister unless I repeat their apology word for word. I need to know how to talk to a trusted adult.",GENERIC,GROOMING,has_grooming_involved=true
72674,An older person online says they can protect my pet if I keep our chat secret.,TECHNOLOGY,GROOMING,has_grooming_involved=true;has_vuln_exploit=true
72675,In a coding club Discord: a prayer group senior makes me follow their private timetable by saying they will scare someone I care about. I need to know how to talk to a trusted adult.,GENERIC,GROOMING,has_grooming_involved=true
72677,The wording is unclear inside a gaming voice lobby: a school trip leader says my brother will learn a lesson if I keep secrets from them. I feel uneasy.,TECHNOLOGY,GROOMING,has_grooming_involved=true;has_vuln_exploit=true
72678,In our game chat the story is incomplete because a class monitor says I should not tell adults about a money collection; I need one careful question before deciding,GENERIC,GROOMING,has_grooming_involved=true
72679,During an online study session: someone older in my activity group will not let me make a normal choice unless I hold money they say adults must not see. says I cannot leave the group unless I do it,TECHNOLOGY,GROOMING,has_grooming_involved=true
72680,"Inside a private homework chat sounds normal to adults, but a dorm monitor calls it obedience when they make me receive small payments for errands they will not explain; warns that I will lose access to notes and rides",GENERIC,GROOMING,has_grooming_involved=true;has_violence_possibility=true
72681,I only know that an older student wants me to bring a closed envelope to someone I do not know on a private study group; I need one careful question before deciding,GENERIC,GROOMING,has_grooming_involved=true
72682,"Nobody says the word crime during an online study session, but my older cousin keeps asking me to send a link from my phone that tricks people about money; says I cannot leave the group unless I do it",TECHNOLOGY,GROOMING,has_grooming_involved=true
72683,On a private study group I felt uneasy when my friend's brother asks me to stand near the door and message if an adult comes; I need one careful question before deciding,GENERIC,GROOMING,has_grooming_involved=true
72684,"Before assembly near the school gate, I stayed quiet after i need help because my class monitor uses rules at a weekend coaching class to make me send a link from my phone that tricks people about money, then turns every no into a punishment",TECHNOLOGY,GROOMING,has_grooming_involved=true
72685,Before a school trip I felt uneasy when a class monitor says I should not tell adults about a money collection; I need one careful question before deciding,GENERIC,GROOMING,has_grooming_involved=true
72686,I only know that a class monitor says I should not tell adults about a money collection on a private study group; I need one careful question before deciding,GENERIC,GROOMING,has_grooming_involved=true
72687,The situation is unclear in a private server: a class monitor says I should not tell adults about a money collection; I need one careful question before deciding,GENERIC,GROOMING,has_grooming_involved=true
72688,"After tuition near the school gate, I wanted help when a family member keeps saying I am safe only if I make a fake excuse call to an adult for them in the school bus queue, but uses my secrets to make me agree",GENERIC,GROOMING,has_grooming_involved=true;has_vuln_exploit=true
72689,"After tuition near the school gate, I did not know what to do when the situation is unclear in a private server: a team senior says I should wait by the gate and signal if someone comes; I need one careful question before deciding",GENERIC,GROOMING,has_grooming_involved=true
72691,On a private study group the story is incomplete because a volunteer leader tells me to send a message from my account because adults trust me more; I need one careful question before deciding,GENERIC,GROOMING,has_grooming_involved=true
72692,In a private server I felt uneasy when a volunteer leader tells me to send a message from my account because adults trust me more; I need one careful question before deciding,GENERIC,GROOMING,has_grooming_involved=true
72693,"After the bell near the school gate, I hesitated because i need help because my class monitor uses rules inside a private homework chat to make me hand over another child's notebook after they distract the teacher, then makes the whole group ignore me when I say no",GENERIC,GROOMING,has_grooming_involved=true;has_medical_concern=true
72694,In a private server the story is incomplete because my friend's brother asks me to stand near the door and message if an adult comes; I need one careful question before deciding,GENERIC,GROOMING,has_grooming_involved=true
72695,The situation is unclear on a private study group: a neighbor kid asks me to say I was with them even though I was not; I need one careful question before deciding,GENERIC,GROOMING,has_grooming_involved=true
72698,An older person online offers gifts if I keep our messages secret from my parents,TECHNOLOGY,GROOMING,has_grooming_involved=true;has_vuln_exploit=true
72699,"During cleanup near the school gate, I looked for advice when near the market after class: someone older in my activity group will not let me make a normal choice unless I hold money they say adults must not see. says I cannot leave the group unless I do it",GENERIC,GROOMING,has_grooming_involved=true
72700,An older student made a quiet request in a private server: they wants me to bring a closed envelope to someone I do not know; I need one careful question before deciding,GENERIC,GROOMING,has_grooming_involved=true
72701,"After homework near the school gate, I looked for advice when a family member keeps saying I am safe only if I make a fake excuse call to an adult for them at the school shop counter, but uses my secrets to make me agree",GENERIC,GROOMING,has_grooming_involved=true;has_vuln_exploit=true
72702,"A class monitor says I should not tell adults about a money collection in our game chat, and I need one careful question before deciding",GENERIC,GROOMING,has_grooming_involved=true
72703,"Before prayer near the school gate, I looked for advice when inside a private homework chat sounds normal to adults, but a dorm monitor calls it obedience when they make me take a parcel from a stranger and bring it to school; warns that I will lose access to notes and rides",GENERIC,GROOMING,has_grooming_involved=true;has_violence_possibility=true
72704,"Someone may call it helping, but a class monitor says I should not tell adults about a money collection on a private study group; I need one careful question before deciding",GENERIC,GROOMING,has_grooming_involved=true
72705,Someone much older says I am mature and should talk to them in a private app,TECHNOLOGY,GROOMING,has_grooming_involved=true
72706,"After practice near the school gate, I stayed quiet after the situation is unclear in a private server: a project captain wants me to keep a parcel overnight but avoids saying whose it is; I need one careful question before deciding",GENERIC,GROOMING,has_grooming_involved=true
72707,"My friend's brother asks me to stand near the door and message if an adult comes in a private server, and I need one careful question before deciding",GENERIC,GROOMING,has_grooming_involved=true
72708,"Before assembly near the art room, I felt unsure as the situation is unclear on a private study group: a family friend wants me to wait outside a shop while they go in, but will not explain why; I need one careful question before deciding",GENERIC,GROOMING,has_grooming_involved=true
72709,"Before assembly near the art room, I kept thinking when the situation is unclear on a private study group: a building group leader says I should not ask why they need my school ID; I need one careful question before deciding",GENERIC,GROOMING,has_grooming_involved=true
72710,"During evening practice, my older sister says I caused the problem, so I must accept their secret rules. The child keeps saying they have no choice.",GENERIC,GROOMING,has_grooming_involved=true;has_vuln_exploit=true
72711,"Inside a class quiz server, an activity coordinator makes every normal choice depend on whether I obey a scary private demand. I need a safe way to talk to someone older.",GENERIC,GROOMING,has_grooming_involved=true
72712,"At the playground boundary wall, a game squad leader says I am safe only if they manage my messages, friends, and private choices. I do not feel safe keeping this secret.",GENERIC,GROOMING,has_grooming_involved=true;has_vuln_exploit=true
72713,"At the apartment lift area, my uncle's friend says I must keep a private video call going or someone close to me gets hurt. I am afraid they will do what they said.",TECHNOLOGY,GROOMING,has_grooming_involved=true;has_emotional_distress=true;has_medical_concern=true
72714,"Inside a livestream fan room, a homework chat owner says I am safe only if they manage my messages, friends, and private choices. I need words to ask for help.",GENERIC,GROOMING,has_grooming_involved=true
72715,"On a gaming voice channel, someone much older says adults will not understand our secret friendship.",TECHNOLOGY,GROOMING,has_grooming_involved=true;has_vuln_exploit=true
72716,"During online tuition chat, an older online friend sends gifts and asks me not to tell my parents.",TECHNOLOGY,GROOMING,has_grooming_involved=true
72717,"During class monitor duty, an older online friend sends gifts and asks me not to tell my parents.",TECHNOLOGY,GROOMING,has_grooming_involved=true
72718,"Inside an online study app, a class prefect says they will hit me if I stop following their secret relationship rule. I am trying to explain it to a trusted adult.",TECHNOLOGY,GROOMING,has_grooming_involved=true;has_vuln_exploit=true
72719,"Inside a private game clan, the practice captain calls it protection while they say I lose help if I keep any privacy and threaten to corner me if I talk to a trusted adult. I do not feel safe keeping this secret.",GENERIC,GROOMING,has_grooming_involved=true;has_vuln_exploit=true
72720,"Inside a class group chat, a school event helper says refusing a private picture request means they will punish my father. My classmate keeps hiding the problem from adults.",TECHNOLOGY,GROOMING,has_grooming_involved=true;has_bullying_involved=true;has_privacy_risk=true
72721,"During class monitor duty, my tuition senior says I should not keep secrets from trusted adults, but then wants all details.",GENERIC,GROOMING,has_grooming_involved=true;has_vuln_exploit=true
72722,"During a school trip meeting, a dance academy helper uses my rabbit to scare me into obeying a private rule. My classmate keeps hiding the problem from adults.",GENERIC,GROOMING,has_grooming_involved=true
72723,"During the morning assembly line, a camp cabin leader makes every normal choice depend on whether I obey a scary private demand. I want to get help without making it worse.",GENERIC,GROOMING,has_grooming_involved=true
72726,"Inside a debate team chat, my friend's older cousin says refusing a private picture request means they will punish my cousin's little sister. I am worried this will keep happening.",GENERIC,GROOMING,has_grooming_involved=true;has_privacy_risk=true
72727,"In the colony play area, a private group owner says it is a game rule, but they control my friends and threaten violence when I quit. I am trying to explain it to a trusted adult.",GENERIC,GROOMING,has_grooming_involved=true;has_violence_possibility=true
72730,"On a gaming voice channel, an activity coordinator says I am safe only if they manage my messages, friends, and private choices. I feel nervous every time my phone lights up.",TECHNOLOGY,GROOMING,has_grooming_involved=true
72731,"At a choir practice hall, my older cousin says private photos should never be shared, but also wants to inspect my gallery.",GENERIC,GROOMING,has_grooming_involved=true;has_privacy_risk=true
72733,"Inside a private game clan, my sports mentor says I should not keep secrets from trusted adults, but then wants all details.",GENERIC,GROOMING,has_grooming_involved=true;has_vuln_exploit=true
72734,"During a wellness check-in, a school house leader forces me to keep a secret chat by threatening someone I love. I am trying to explain it to a trusted adult.",GENERIC,GROOMING,has_grooming_involved=true;has_vuln_exploit=true
72735,"At the school gate after class, an online teammate says it is normal for older kids to demand private pictures and punish no. My cousin wants help but is afraid of punishment.",TECHNOLOGY,GROOMING,has_grooming_involved=true;has_emotional_distress=true;has_privacy_risk=true
72736,"In a weekend art class, my friend's older cousin tells me I must accept their private request or they will hurt someone I care about. They say I am dramatic when I object.",GENERIC,GROOMING,has_grooming_involved=true;has_violence_possibility=true;has_medical_concern=true
72737,"During an online music collaboration, a classroom seating monitor says they will hit me if I stop following their secret relationship rule. I am trying to explain it to a trusted adult.",TECHNOLOGY,GROOMING,has_grooming_involved=true;has_vuln_exploit=true
72738,"Inside a school event team chat, a dance senior says they will hurt me if I tell a trusted adult about the uncomfortable messages. I do not want the private request to continue.",GENERIC,GROOMING,has_grooming_involved=true;has_coercive_control=true;has_medical_concern=true
72739,"At my aunt's place before dinner, an older online friend sends gifts and asks me not to tell my parents.",TECHNOLOGY,GROOMING,has_grooming_involved=true
72740,"Inside a shared project folder, a building group leader uses my younger cousin to scare me into obeying a private rule. My friend is worried a loved one will be hurt.",GENERIC,GROOMING,has_grooming_involved=true;has_medical_concern=true
72741,"During a charity collection activity, a school trip coordinator makes every normal choice depend on whether I obey a scary private demand. I need words to ask for help.",GENERIC,GROOMING,has_grooming_involved=true
72742,"At a cousins' sleepover, a chat moderator says the private photo request is harmless, yet they threaten my friend if I refuse. I am trying to explain it to a trusted adult.",GENERIC,GROOMING,has_grooming_involved=true;has_vuln_exploit=true;has_privacy_risk=true
72743,"While waiting for the school van, a class prefect says it is normal for older kids to demand private pictures and punish no. I feel nervous every time my phone lights up.",TECHNOLOGY,GROOMING,has_grooming_involved=true;has_privacy_risk=true
72745,"At a residential coaching center, a coding contest teammate says it is normal for older kids to demand private pictures and punish no. My cousin wants help but is afraid of punishment.",GENERIC,GROOMING,has_grooming_involved=true;has_emotional_distress=true;has_privacy_risk=true
72747,"At the school sports shed, a school trip coordinator says I am safe only if they manage my messages, friends, and private choices. I do not feel safe keeping this secret.",GENERIC,GROOMING,has_grooming_involved=true;has_vuln_exploit=true
72748,"Inside a private language-learning group, a class representative tells me not to involve adults because things will get painful for people I love. I do not want to be alone with this anymore.",SCIENCE,GROOMING,has_grooming_involved=true;has_emotional_distress=true;has_medical_concern=true
72749,"At a cousins' sleepover, a class senior uses my pet bird to scare me into obeying a private rule. I am trying to explain it to a trusted adult.",GENERIC,GROOMING,has_grooming_involved=true
72752,"Inside a private language-learning group, a shared-laptop owner says I am safe only if they manage my messages, friends, and private choices. I need help deciding what to do next.",GENERIC,GROOMING,has_grooming_involved=true
72754,"Inside our family video call, my neighbor's older child says I caused the problem, so I must accept their secret rules. I feel like refusing is not allowed.",TECHNOLOGY,GROOMING,has_grooming_involved=true;has_vuln_exploit=true;has_coercive_control=true
72757,"Inside a school photo sharing folder, a class prefect says I caused the problem, so I must accept their secret rules. The younger player thinks the group will turn on them.",GENERIC,GROOMING,has_grooming_involved=true;has_vuln_exploit=true
72758,"Inside an online chess lobby, my friend's older cousin says they can ruin and hurt the people around me if I do not obey. I do not want the private request to continue.",TECHNOLOGY,GROOMING,has_grooming_involved=true;has_medical_concern=true
72759,"Inside a school safety patrol group, a debate society captain says I should not keep secrets from trusted adults, but then wants all details.",GENERIC,GROOMING,has_grooming_involved=true;has_vuln_exploit=true
72760,"At a hostel phone collection desk, a volunteer captain says they will hurt me if I tell a trusted adult about the uncomfortable messages. I do not want the private request to continue.",TECHNOLOGY,GROOMING,has_grooming_involved=true;has_coercive_control=true;has_medical_concern=true
72761,"At my aunt's place before dinner, someone much older says adults will not understand our secret friendship.",GENERIC,GROOMING,has_grooming_involved=true;has_vuln_exploit=true
72762,"Inside a private game clan, a chat moderator tells me not to involve adults because things will get painful for people I love. My cousin wants help but is afraid of punishment.",SCIENCE,GROOMING,has_grooming_involved=true;has_emotional_distress=true;has_medical_concern=true
72763,"At home after school, someone much older says adults will not understand our secret friendship.",GENERIC,GROOMING,has_grooming_involved=true;has_vuln_exploit=true
72764,"While returning from tuition, a school trip coordinator says I am safe only if they manage my messages, friends, and private choices. I need help deciding what to do next.",GENERIC,GROOMING,has_grooming_involved=true
72766,"Inside a livestream fan room, my stepbrother says I should not keep secrets from trusted adults, but then wants all details.",GENERIC,GROOMING,has_grooming_involved=true;has_vuln_exploit=true
72767,"In a weekend art class, a private forum moderator says I should not keep secrets from trusted adults, but then wants all details.",GENERIC,GROOMING,has_grooming_involved=true;has_vuln_exploit=true
72768,"At a science fair preparation room, a team vice-captain says it is normal for older kids to demand private pictures and punish no. I need a safe way to talk to someone older.",GENERIC,GROOMING,has_grooming_involved=true;has_privacy_risk=true
72769,"During evening practice, an older online friend sends gifts and asks me not to tell my parents.",TECHNOLOGY,GROOMING,has_grooming_involved=true
72770,"Inside a school safety patrol group, a mentor's assistant forces me to keep a secret chat by threatening someone I love. This keeps happening when no adult is nearby.",GENERIC,GROOMING,has_grooming_involved=true;has_vuln_exploit=true
72771,"During class monitor duty, my friend's older cousin jokes that people who disobey get hurt, then asks me to keep a private chat. I need words to ask for help.",GENERIC,GROOMING,has_grooming_involved=true;has_medical_concern=true
72773,"During a study camp evening, my older sister says I should not keep secrets from trusted adults, but then wants all details.",GENERIC,GROOMING,has_grooming_involved=true;has_vuln_exploit=true
72774,"During a coding club session, the group admin pressures me into a secret relationship role and says my rabbit will suffer if I stop replying. This keeps happening when no adult is nearby.",GENERIC,GROOMING,has_grooming_involved=true;has_vuln_exploit=true
72776,"At a neighbor's birthday planning, the bus group leader says I should not keep secrets from trusted adults, but then wants all details.",GENERIC,GROOMING,has_grooming_involved=true;has_vuln_exploit=true
72777,"At a coaching class staircase, a private account keeps praising me and asking which school gate I use.",GENERIC,GROOMING,has_grooming_involved=true
72778,"Inside a homework buddy chat, my aunt's son says the private photo request is harmless, yet they threaten my friend if I refuse. I noticed they avoid adults after this happens.",GENERIC,GROOMING,has_grooming_involved=true;has_vuln_exploit=true;has_privacy_risk=true
72779,"Inside a youth volunteer group, my neighbor's older child says refusing a private picture request means they will punish my pet cat. I want to stop the pressure without getting hurt.",GENERIC,GROOMING,has_grooming_involved=true;has_medical_concern=true;has_privacy_risk=true
72780,"In a music band practice room, a homework chat owner makes every normal choice depend on whether I obey a scary private demand. I need words to ask for help.",GENERIC,GROOMING,has_grooming_involved=true
72781,"Inside a robotics discord group, a building group leader makes every normal choice depend on whether I obey a scary private demand. I keep feeling like I have no choice.",GENERIC,GROOMING,has_grooming_involved=true
72784,"At a faith-based weekend class, the online class monitor says it is normal for older kids to demand private pictures and punish no. I feel nervous every time my phone lights up.",TECHNOLOGY,GROOMING,has_grooming_involved=true;has_privacy_risk=true
72786,"During a coding club session, a robotics club lead makes every normal choice depend on whether I obey a scary private demand. I keep feeling like I have no choice.",GENERIC,GROOMING,has_grooming_involved=true
72787,"At lunch near the basketball court, a volunteer captain makes every normal choice depend on whether I obey a scary private demand. The younger child thinks it is their fault.",GENERIC,GROOMING,has_grooming_involved=true
72788,"At a craft workshop table, a private group owner says keeping adults out is necessary, then threatens me for asking questions. My classmate keeps hiding the problem from adults.",GENERIC,GROOMING,has_grooming_involved=true
72789,"During drawing class cleanup, someone much older says adults will not understand our secret friendship.",GENERIC,GROOMING,has_grooming_involved=true;has_vuln_exploit=true
72790,"At a sports practice ground, a class representative uses my cousin to scare me into obeying a private rule. I noticed they avoid adults after this happens.",GENERIC,GROOMING,has_grooming_involved=true
72792,"Inside an online study app, a youth group helper keeps using fear of violence to make me stay silent about their private rules. I noticed they avoid adults after this happens.",TECHNOLOGY,GROOMING,has_grooming_involved=true;has_violence_possibility=true
72793,"During homework planning, a neighborhood team captain says it is normal for older kids to demand private pictures and punish no. My classmate keeps hiding the problem from adults.",GENERIC,GROOMING,has_grooming_involved=true;has_privacy_risk=true
72797,"Inside a school house team, a field trip volunteer says I am safe only if they manage my messages, friends, and private choices. I feel like refusing is not allowed.",GENERIC,GROOMING,has_grooming_involved=true;has_coercive_control=true
72798,"During weekend coding practice, a study circle lead says it is normal for older kids to demand private pictures and punish no. My friend says the rule comes with threats.",GENERIC,GROOMING,has_grooming_involved=true;has_privacy_risk=true
72799,"At the building park benches, an art class senior says nobody will believe me if I tell, then keeps ordering me to do private things. This keeps happening when no adult is nearby.",SCIENCE,GROOMING,has_grooming_involved=true
72800,"During a school magazine meeting, a game squad leader says nobody will believe me if I tell, then keeps ordering me to do private things. My classmate keeps hiding the problem from adults.",SCIENCE,GROOMING,has_grooming_involved=true
72801,"Inside a private language-learning group, my older sister says they can ruin and hurt the people around me if I do not obey. I feel stuck and do not know what to say.",GENERIC,GROOMING,has_grooming_involved=true;has_medical_concern=true
